{
  "schemaVersion": 1,
  "generatedAt": "2026-07-21T13:45:40.807197Z",
  "assetBase": "/assets/examples/",
  "examples": [
    {
      "id": "layout-doubao-seed-2-pro-high",
      "task": "layout",
      "modelId": "doubao-seed-2-pro-high",
      "title": "Doubao Seed 2.0 Pro High \u00b7 DiningRoom-13034",
      "sourceInstance": "DiningRoom-13034 \u00b7 single-view Layout",
      "metrics": [
        {
          "id": "ADD-S",
          "label": "ADD-S",
          "value": 0.1672,
          "direction": "lower",
          "unit": " m"
        },
        {
          "id": "Chamfer",
          "label": "Chamfer",
          "value": 0.2831,
          "direction": "lower",
          "unit": " m"
        },
        {
          "id": "Placement",
          "label": "Placement accuracy",
          "value": 0.0,
          "direction": "higher"
        }
      ],
      "referenceImages": [
        {
          "src": "/assets/references/layout/reference.webp",
          "alt": "Reference view for DiningRoom-13034."
        }
      ],
      "outputImages": [],
      "outputGlb": {
        "src": "/assets/examples/layout-doubao-seed-2-pro-high/scene.glb",
        "alt": "Interactive Doubao Seed 2.0 Pro High Layout GLB."
      },
      "referenceGlb": {
        "src": "/assets/references/layout/gt-scene.glb",
        "alt": "Interactive ground-truth layout scene."
      },
      "referenceGlbAnimated": false,
      "referenceVideos": []
    },
    {
      "id": "camera-doubao-seed-2-pro-high",
      "task": "camera",
      "modelId": "doubao-seed-2-pro-high",
      "title": "Doubao Seed 2.0 Pro High \u00b7 Bedroom-5088",
      "sourceInstance": "Bedroom-5088 \u00b7 hidden camera extrinsics",
      "metrics": [
        {
          "id": "PE",
          "label": "Position Error",
          "value": 2.9791,
          "direction": "lower",
          "unit": " m"
        },
        {
          "id": "AE",
          "label": "Angular Error",
          "value": 155.4185,
          "direction": "lower",
          "unit": "\u00b0"
        }
      ],
      "referenceImages": [
        {
          "src": "/assets/references/camera/reference.webp",
          "alt": "Agent-visible reference image for Bedroom-5088."
        }
      ],
      "outputImages": [
        {
          "src": "/assets/examples/camera-doubao-seed-2-pro-high/agent-view.png",
          "alt": "Rendered view from Doubao Seed 2.0 Pro High's predicted camera."
        }
      ],
      "poseJson": "{\n  \"agent_position\": [\n    -4.0,\n    -1.5,\n    1.2000000476837158\n  ],\n  \"agent_look_dir\": [\n    -0.9353047013282776,\n    -0.35073935985565186,\n    0.04676547273993492\n  ],\n  \"agent_matrix_world\": [\n    [\n      -0.35112354159355164,\n      0.04378790035843849,\n      0.9353047013282776,\n      -4.0\n    ],\n    [\n      0.9363291263580322,\n      0.0164203979074955,\n      0.35073935985565186,\n      -1.5\n    ],\n    [\n      6.539171693020762e-08,\n      0.9989058971405029,\n      -0.04676547273993492,\n      1.2000000476837158\n    ],\n    [\n      0.0,\n      0.0,\n      0.0,\n      1.0\n    ]\n  ],\n  \"agent_fov_x_deg\": 39.6\n}",
      "referenceGlb": {
        "src": "/assets/references/camera/gt-scene.glb",
        "alt": "Interactive ground-truth camera scene."
      },
      "referenceGlbAnimated": false,
      "referenceVideos": []
    },
    {
      "id": "articulated-doubao-seed-2-pro-high",
      "task": "articulated",
      "modelId": "doubao-seed-2-pro-high",
      "title": "Doubao Seed 2.0 Pro High \u00b7 Kitchen cabinet",
      "sourceInstance": "S2O ACD kitchen cabinet \u00b7 32 ordered states",
      "metrics": [
        {
          "id": "MPE",
          "label": "Maximum Part Error",
          "value": 0.5609,
          "direction": "lower",
          "unit": " m"
        },
        {
          "id": "Mean Part",
          "label": "Mean Part Error",
          "value": 0.5596,
          "direction": "lower",
          "unit": " m"
        },
        {
          "id": "Recall",
          "label": "Movable recall",
          "value": 0.0,
          "direction": "higher"
        }
      ],
      "referenceImages": [
        {
          "src": "/assets/references/articulated/reference-0001.jpg",
          "alt": "Articulated input frame 1: closed state."
        },
        {
          "src": "/assets/references/articulated/reference-0016.jpg",
          "alt": "Articulated input frame 16: open state."
        },
        {
          "src": "/assets/references/articulated/reference-0032.jpg",
          "alt": "Articulated input frame 32: closed state."
        }
      ],
      "outputImages": [],
      "animatedGlb": {
        "src": "/assets/examples/articulated-doubao-seed-2-pro-high/animation.glb",
        "alt": "Interactive static Doubao Seed 2.0 Pro High articulated submission."
      },
      "hasAnimation": false,
      "keyframes": [],
      "notes": "The submitted GLB contains no animated channels; the viewer preserves this static articulated failure.",
      "referenceGlb": {
        "src": "/assets/references/articulated/gt-open.glb",
        "alt": "Interactive ground-truth fully open articulated state.",
        "poster": "/assets/references/articulated/reference-0016.jpg"
      },
      "referenceGlbAnimated": false,
      "referenceVideos": [
        {
          "src": "/assets/references/articulated/reference.mp4",
          "alt": "Agent-visible open-close articulated input video.",
          "poster": "/assets/references/articulated/reference-0001.jpg"
        }
      ]
    },
    {
      "id": "reconstruction-doubao-seed-2-pro-high",
      "task": "reconstruction",
      "modelId": "doubao-seed-2-pro-high",
      "title": "Doubao Seed 2.0 Pro High \u00b7 SecondBedroom-5427",
      "sourceInstance": "SecondBedroom-5427 \u00b7 calibrated multi-view Reconstruction",
      "metrics": [
        {
          "id": "F@5%",
          "label": "Object F@5%",
          "value": 0.3598,
          "direction": "higher"
        },
        {
          "id": "Coverage",
          "label": "Object coverage",
          "value": 0.25,
          "direction": "higher"
        },
        {
          "id": "Centroid",
          "label": "Mean centroid error",
          "value": 0.1717,
          "direction": "lower",
          "unit": " m"
        }
      ],
      "referenceImages": [
        {
          "src": "/assets/references/reconstruction/reference-0000.webp",
          "alt": "Calibrated reconstruction reference view 1."
        },
        {
          "src": "/assets/references/reconstruction/reference-0002.webp",
          "alt": "Calibrated reconstruction reference view 3."
        }
      ],
      "outputImages": [
        {
          "src": "/assets/examples/reconstruction-doubao-seed-2-pro-high/agent-view-0.png",
          "alt": "Doubao Seed 2.0 Pro High reconstruction from calibrated view 1."
        },
        {
          "src": "/assets/examples/reconstruction-doubao-seed-2-pro-high/agent-view-2.png",
          "alt": "Doubao Seed 2.0 Pro High reconstruction from calibrated view 3."
        }
      ],
      "outputGlb": {
        "src": "/assets/examples/reconstruction-doubao-seed-2-pro-high/scene.glb",
        "alt": "Interactive Doubao Seed 2.0 Pro High Reconstruction GLB.",
        "poster": "/assets/examples/reconstruction-doubao-seed-2-pro-high/agent-view-0.png"
      },
      "referenceGlb": {
        "src": "/assets/references/reconstruction/gt-scene.glb",
        "alt": "Interactive ground-truth reconstruction scene."
      },
      "referenceGlbAnimated": false,
      "referenceVideos": []
    },
    {
      "id": "dynamic-doubao-seed-2-pro-high",
      "task": "dynamic",
      "modelId": "doubao-seed-2-pro-high",
      "title": "Doubao Seed 2.0 Pro High \u00b7 Castle siege",
      "sourceInstance": "Castle siege \u00b7 paired 144-frame low-poly / photo-realistic Dynamic",
      "metrics": [
        {
          "id": "MME",
          "label": "Maximum Mover Error",
          "value": 0.461,
          "direction": "lower"
        },
        {
          "id": "AME",
          "label": "Average Mover Error",
          "value": 0.3556,
          "direction": "diagnostic"
        },
        {
          "id": "LE",
          "label": "Layout Error",
          "value": 0.337,
          "direction": "lower"
        }
      ],
      "referenceImages": [
        {
          "src": "/assets/references/dynamic/low-poly.png",
          "alt": "Low-poly Dynamic input frame."
        },
        {
          "src": "/assets/references/dynamic/photo-realistic.png",
          "alt": "Photo-realistic Dynamic input frame."
        }
      ],
      "outputImages": [],
      "animatedGlb": {
        "src": "/assets/examples/dynamic-doubao-seed-2-pro-high/animation.glb",
        "alt": "Interactive animated Doubao Seed 2.0 Pro High Dynamic GLB."
      },
      "hasAnimation": true,
      "pairedAnimatedGlb": {
        "src": "/assets/examples/dynamic-doubao-seed-2-pro-high/paired-animation.glb",
        "alt": "Interactive static Doubao Seed 2.0 Pro High photo-realistic-input Dynamic submission."
      },
      "pairedHasAnimation": false,
      "lowPolyPreviews": [],
      "photorealisticPreviews": [],
      "notes": "The two interactive GLBs compare submissions from the low-poly base condition and the paired photo-realistic-input condition. The paired T7 submission also contains no animation. Native metrics below are from the T6 low-poly base condition.",
      "referenceGlb": {
        "src": "/assets/references/dynamic/gt-scene.glb",
        "alt": "Interactive animated ground-truth Dynamic scene.",
        "poster": "/assets/references/dynamic/low-poly.png"
      },
      "referenceGlbAnimated": true,
      "referenceVideos": [
        {
          "src": "/assets/references/dynamic/reference-lowpoly.mp4",
          "alt": "Agent-visible low-poly Dynamic input video.",
          "poster": "/assets/references/dynamic/low-poly.png"